<!ELEMENT burgerownia (burger*)>
<!ELEMENT burger (nazwa, składnik*, alergen*)>
<!ELEMENT nazwa (#PCDATA)>
<!ELEMENT składniki (składnik+)
<!ELEMENT składnik (#PCDATA)>
<!ELEMENT alergeny (alergen*)
<!ELEMENT alergen (#PCDATA)>